ID,Name_lang,SourceText_lang,Description_lang
1407,Callow Flayedwing,|cFFFFD200Zone: |rMaldraxxus,"Flayedwings are a necessary force in the cycle of life for the Shadowlands, acting as both prey and predator for the harsh environment of Maldraxxus."
1408,Gruesome Flayedwing,|cFFFFD200Covenant Feature: |rThe Ember Court|n|cFFFFD200Covenant: |rVenthyr|n|n|cFFFFD200Covenant Feature: |rQueen's Conservatory|n|cFFFFD200Covenant: |rNight Fae|n|n|cFFFFD200Covenant Feature: |rPath of Ascension|n|cFFFFD200Covenant: |rKyrian|n|n|cFFFFD200Covenant Feature: |rAbomination Factory|n|cFFFFD200Covenant: |rNecrolord,"The flayedwings of Maldraxxus are prized for their ability to soar effortlessly through the skies of the Shadowlands, allowing their rider a surprise opportunity to strike at their foes or support their allies."
1409,Bonesewn Fleshroc,|cFFFFD200Profession:|r Abominable Stitching|n|cFFFFD200Zone:|r Maldraxxus,Only expert flesh-stitchers who have demonstrated mastery over the magics of Maldraxxus are powerful enough to construct a deathroc of this size.
1410,Hulking Deathroc,|cFFFFD200Drop: |rViolet Mistake|n|cFFFFD200Zone: |rMaldraxxus,"Deathrocs are stitched monstrosities from the discarded viscera, bone, and organs that were not required to construct soldiers for the House of Constructs."
1411,Predatory Plagueroc,|cFFFFD200Drop: |rGieger|n|cFFFFD200Covenant: |rNecrolord|n|cFFFFD200Zone: |rMaldraxxus,"Gieger's everlasting hunger is legendary amongst the House of Constructs, and no beast is too large or bony to fit inside its massive stomach."
1413,Dauntless Duskrunner,|cFFFFD200Covenant Feature: |rThe Ember Court|n|cFFFFD200Covenant: |rVenthyr|n|n|cFFFFD200Covenant Feature: |rQueen's Conservatory|n|cFFFFD200Covenant: |rNight Fae|n|n|cFFFFD200Covenant Feature: |rPath of Ascension|n|cFFFFD200Covenant: |rKyrian|n|n|cFFFFD200Covenant Feature: |rAbomination Factory|n|cFFFFD200Covenant: |rNecrolord,"The Path of Ascension is a challenging trial, and those that display all of the facets the Kyrian hold dear will be duly rewarded."
1414,Sinrunner Blanchy,|cFFFFD200NPC:|r Dead Blanchy |n|cFFFFD200Location:|r Revendreth|n |n,"In life, Blanchy appeared to be an affectionate, well-behaved horse of excellent disposition and appetite. What evils must she have committed in secret to have earned her place among the condemned souls of Revendreth?"
1415,Arboreal Gulper,|cFFFFD200Drop: |rHumon'gozz|n|cFFFFD200Zone: |rArdenweald,"The wood and foliage growing atop this toad is a natural part of its body, helping it siphon anima from the air to nourish itself."
1416,Mawsworn Charger,"|cFFFFD200Achievement:|r Flawless Master|n|cFFFFD200Zone:|r Torghast, Tower of the Damned",The fate of all horse mounts.
1417,Hand of Hrestimorak,|cFFFFD200Achievement:|r Glory of the Dominant Raider|n|cFFFFD200Zone:|r Sanctum of Domination,"The treachery of Hrestimorak was infamous, betraying his people to claim power. Facing damnation in the Maw, he tried to subvert the Jailer... a foolish act that would earn him an eternity of torment."
1419,Sintouched Deathwalker,|cFFFFD200Achievement: |rShadowlands Keystone Master: Season One|n|cFFFFD200Category: |rDungeons,Forged from the sins of countless diabolical dungeon denizens. Only those with the skills to overcome them may hold its reins.
1420,Umbral Scythehorn,|cFFFFD200Vendor: |rSpindlenose|n|cFFFFD200Zone: |rArdenweald|n,"Umbral gorm are the most docile of all gorm, but they also grow the largest horns and mandibles. They are probably so docile because other creatures avoid riling them."
1421,Court Sinrunner,|cFFFFD200Vendor: |rMistress Mihaela|n|cFFFFD200Zone: |rRevendreth|n|cFFFFD200Faction: |rCourt of Harvesters - Exalted|n|cFFFFD200Cost: |r30000|TINTERFACE\MONEYFRAME\UI-GOLDICON.BLP:0|t,"Sinrunners were once the steeds of dark souls, carried in the wake of either their sins or their masters' sins to Revendreth. While some chose to run free, many continue to serve darkness in death as they did in life."
1422,Warstitched Darkhound,|cFFFFD200Adventures:|r Shadowlands,"These warhounds are crafted by the House of Constructs to carry any rider into the thick of battle, rending and tearing enemy mounts all the while."
1423,Highwind Darkmane,|cFFFFD200Adventures:|r Shadowlands,"The Forsworn and their mounts take on a darker aspect upon renouncing the path laid forth by the Archon. While tame enough to ride, the Highwind Darkmane has a fiercely independent streak."
1424,Snowstorm,|cFFFFD200Blizzard's 30th Anniversary|r ,"He comes from the ice and snow, under the Azeroth sun where adventurers go."
1425,Gilded Prowler,|cFFFFD200Vendor: |rAdjutant Nikos|n|cFFFFD200Zone: |rBastion|n|cFFFFD200Cost: |r30000|TINTERFACE\MONEYFRAME\UI-GOLDICON.BLP:0|t,"The mighty larion is an apex predator of Bastion, but that does not stop it from enjoying a nice nap in the sunny fields."
1426,Ascended Skymane,|cFFFFD200Treasure: |rCache of the Ascended|n|cFFFFD200Zone: |rBastion,Only those that have proven themselves against the combined might of the Ascended will be able to ride this mount.
1428,Amber Ardenmoth,|cFFFFD200Drop:|r Wild Hunt Supplies|n|cFFFFD200Zone:|r Ardenweald|n,The brilliant orange hue of the amber ardenmoth signals to predators that it is dangerous to eat. Consuming one of these creatures will put a predator into a dreamless sleep for years.
1429,Vibrant Flutterwing,|cFFFFD200Vendor: |rCortinarius|n|cFFFFD200Zone: |rArdenweald,These minty green moths are very friendly. They particularly enjoy having their head fuzz vigorously brushed. They also enjoy music and poetry.
1430,Desertwing Hunter,|cFFFFD200Profession: |rProtoform Synthesis,"In service of the great Purpose, desertwing hunters were designed to fill distant skies of forgotten realms of the Shadowlands."
1431,Pale Regal Cervid,|cFFFFD200Profession: |rProtoform Synthesis,"Looking at these majestic creatures, it's not difficult to see how the idea of cervids developed into the stags found on Azeroth and other mortal worlds."
1433,Vespoid Flutterer,|cFFFFD200Profession: |rProtoform Synthesis,"A flutterer is an overgrown vespoid worker created to carry a rider. Rather than looking to a queen for leadership, it looks to its rider to guide it in all things."
1434,Deepstar Aurelid,|cFFFFD200Drop:|r Hirukon|n|cFFFFD200Zone:|r Zereth Mortis,"As one of the last remaining polyps of an elusive creature, this aurelid is at home in the water as much as the air."
1436,Battle-Hardened Aquilon,|cFFFFD200Covenant: |rKyrian|n|cFFFFD200Vendor: |rDuchess Mynx|n|cFFFFD200Zone: |rKorthia|n|cFFFFD200Cost: |r1000|Hcurrency:1767|h|TInterface\ICONS\INV_Stygia.BLP:0|t|h|n|cFFFFD200Achievement: |rOn the Offensive,"The aquilon can be a valuable ally in combat, with capabilities exceeding those of the phalynx."
1437,Battle-Bound Warhound,|cFFFFD200Drop: |rTheater of Pain|n|cFFFFD200Zone: |rMaldraxxus,"Warhounds find comfort in conflict, and the Contest of Conquest is the perfect place to find these beasts honing their abilities."
1438,Bulbous Necroray,|cFFFFD200Drop:|r Oozing Necroray Egg|n,The necrorays of Maldraxxus prefer to congregate around the enormous decaying mushrooms of the region.
1439,Infested Necroray,|cFFFFD200Drop:|r Oozing Necroray Egg|n,Necrorays lay their eggs in small clusters within the frills and hollows of decaying fungal blooms.
1440,Pestilent Necroray,|cFFFFD200Drop:|r Oozing Necroray Egg|n,"When a necroray hatches, spores fly everywhere, making a huge mess."
1441,Bound Shadehound,|cFFFFD200Quest:|r Feral Shadehound|n|cFFFFD200Zone: |rThe Maw,"Created by deciphering and performing powerful runic magic, this Shadehound is bound to its creator."
1442,Corridor Creeper,|cFFFFD200Achievement: |rTwisting Corridors: Layer 8|n|cFFFFD200Category: |rTorghast,The loyal hounds of the Jailer creep along the corridors in search of the scent of souls.
1443,Voracious Gorger,|cFFFFD200Achievement: |rGlory of the Shadowlands Hero|n|cFFFFD200Category: |rDungeons & Raids,"The devourers are presumed to have their origins in the In-Between, a space between the lands of the Shadowlands that few have explored."
1444,Viridian Phase-Hunter,|cFFFFD200Promotion|r,"Hailing from a species already adept at natural camouflage, the otherworldly energies that transformed Draenor into Outland gave these creatures the ability to shift through space."
1445,Slime Serpent,|cFFFFD200Drop: |rSlime Serpent|n|cFFFFD200Zone: |rPlaguefall,This mysterious creature lurks beneath the slime pools of Plaguefall. No one knows where it came from.
1446,Tazavesh Gearglider,|cFFFFD200Achievement: |rFake It 'Til You Make It|n|cFFFFD200Category: |rShadowlands Dungeon,"Brokers of all types use these gliders to travel around Tazavesh and similar nearby outposts, and carry their goods as well."
1448,Serenade,|cFFFFD200Profession: |rProtoform Synthesis,"These beautiful helicids emerge only at night. When they are pleased, their shells hum with a joyful melody."
1449,Lord of the Corpseflies,|cFFFFD200Covenant: |rNecrolord|n|cFFFFD200Drop:|r Fleshwing|n|cFFFFD200Zone:|r Korthia ,"To be the Lord of the Corpseflies, you've got to lay a LOT of eggs."
1450,Soaring Razorwing,|cFFFFD200Vendor: |rArchivist Roh-Suir|n|cFFFFD200Zone: |rKorthia|n|cFFFFD200Faction: |rThe Archivists' Codex - Tier 6|n|cFFFFD200Cost: |r5000|Hcurrency:1931|h|TInterface\ICONS\INV_Misc_PaperBundle04a.BLP:0|t|h,"The hide of the razorwing is light, allowing it to fly, but also quite tough, allowing them to survive passage into the Maw."
1451,Vicious War Croaker,|cFFFFD200PvP:|r Shadowlands: Season 3|nRated Arena and Rated Battleground Season Reward,"These creatures are so enthusiastic when charging into battle that they will croak out something that sounds very much like ""FOR THE HORDE!"""
1452,Vicious War Croaker,|cFFFFD200PvP:|r Shadowlands: Season 3|nRated Arena and Rated Battleground Season Reward,"These creatures are so enthusiastic when charging into battle that they will croak out something that sounds very much like ""FOR THE ALLIANCE!"""
1454,Tamed Mauler,|cFFFFD200Drop:|r Supplies of the Archivist's Codex|n|cFFFFD200Zone:|r Korthia |n,"When it comes to taming devourers, all it takes is a little anima and a lot of patience. And a lot of healing potions."
1455,Beryl Shardhide,|cFFFFD200Drop:|r Death's Advance Supplies|n|cFFFFD200Zone:|r Korthia,"These shardhides find it easy to hide in the underbrush, and it is rare to find one that is tamed."
1456,Sapphire Skyblazer,|cFFFFD200Promotion|r |n,"These brilliant blue birds burn brighter (and hotter) than their orange cousins, though the origin of both remains a mystery."
1458,Wandering Ancient,|cFFFFD200Promotion|r,"A staunch defender of the forests of Azeroth, the ancients are also known for their glorious canopies of leaves, which change color with the seasons."
1459,Vicious War Gorm,|cFFFFD200PvP:|r Shadowlands: Season 2|nRated Arena and Rated Battleground Season Reward,"The gorm love eating the corpses of your enemies, so this seemed like a natural fit."
1460,Vicious War Gorm,|cFFFFD200PvP:|r Shadowlands: Season 2|nRated Arena and Rated Battleground Season Reward,"The gorm love eating the corpses of your enemies, so this seemed like a natural fit."
1465,Vicious Warstalker,|cFFFFD200PvP:|r Shadowlands: Season 4|nRated Arena and Rated Battleground Season Reward,Trample the Horde to dust while riding a majestic protoform wolf! For the Alliance!
1466,Vicious Warstalker,|cFFFFD200PvP:|r Shadowlands: Season 4|nRated Arena and Rated Battleground Season Reward,Trample the Alliance to dust while riding a majestic protoform wolf! For the Horde!
1467,Noble Bruffalon,|cFFFFD200Vendor: |rStorykeeper Ashekh|n|cFFFFD200Zone: |rThe Forbidden Reach|n|cFFFFD200Cost: |r100000|Hcurrency:2118|h|TInterface\ICONS\INV_Misc_Powder_Thorium.blp:0|t|h,It is a great honor to be trusted with one of the Maruuk's loyal hunting companions. This Bruffalon is reliable and steadfast through any hardship.
1468,Amber Skitterfly,|cFFFFD200Trading Post|r|n,"A gift from Granpap Whiskers to the Trading Post, amber skitterflies are remarkably docile."
1469,Magmashell,|cFFFFD200Item: |rEmpty Magma Shell|n|cFFFFD200Zone: |rThe Waking Shores,"Who's a good little new-forged snail made entirely of elemental lava? You are! Yes, you!"
1471,Vengeance,|cFFFFD200Drop:|r Lady Sylvanas Windrunner|n|cFFFFD200Zone:|r Sanctum of Domination|n|cFFFFD200Difficulty:|r Mythic,"Sylvanas lost a part of herself the day Arthas took her life, and the darkness within her grew to fill the void."
1474,Bestowed Thunderspine Packleader,|cFFFFD200Achievement:|r Centaur of Attention|n|cFFFFD200Category:|r Exploration,"A gift from Merithra, who blessed these thunderspines to ensure that no matter where the Maruuk clans roam, they will always be under the green dragonflight's protection."
1475,Hand of Bahmethra,|cFFFFD200Drop:|r Tormentors of Torghast|n|cFFFFD200Zone:|r The Maw|n,"The most wicked and cruel of her kin, Bahmethra endured the full measure of the Banished One's punishments before her fall."
1476,Wild Hunt Legsplitter,|cFFFFD200Drop:|r War Chest of the Wild Hunt|n|cFFFFD200Zone:|r The Maw,"Integrated into the depleted forces of the Wild Hunt, the fawn riders quickly found that the gorm's powerful mandibles were perfect for cutting down close enemy ranks."
1477,Undying Darkhound,|cFFFFD200Drop:|r War Chest of the Undying Army|n|cFFFFD200Zone:|r The Maw ,"The Undying Darkhound's parts have graced many battlefields, yet this latest battle may have been the first time they all fought together."
1478,Skyskin Hornstrider,|cFFFFD200Vendor:|r Brendormi|n|cFFFFD200Cost:|r 150|Hitem:202039|h|TInterface\ICONS\inv_misc_stormlordsfavor.blp:0|t|h 3000|Hcurrency:2118|h|TInterface\ICONS\INV_Misc_Powder_Thorium.blp:0|t|h,The instability of primalist storms in potential timelines sometimes causes creatures to absorb the energies from the very storms. These creatures tend to be docile towards those who are able to face the fury of these chronomatic anomalies.
1480,Unchained Gladiator's Soul Eater,|cFFFFD200Achievement: |rGladiator: Shadowlands Season 2|n|cFFFFD200Category: |rPlayer vs. Player,This soul eater's gaze unnerves you. Best not meet its eyes for too long.
1481,Cartel Master's Gearglider,"|cFFFFD200Drop:|r So'leah|n|cFFFFD200Zone:|r Tazavesh, the Veiled Market|n",Only the richest cartel leaders are able to afford the metals required to craft the Cartel Master's Gearglider.
1484,Ardenweald Wilderling,|cFFFFD200Covenant: |rNight Fae|n|cFFFFD200Zone: |rArdenweald,"As anima flows to the distant wealds of Ardenweald once more, the wilderlings awaken and cautiously emerge from their canopy burrows."
1485,Autumnal Wilderling,|cFFFFD200Covenant: |rNight Fae|n|cFFFFD200Vendor: |rElwyn|n|cFFFFD200Zone: |rArdenweald|n|cFFFFD200Cost: |r7500|Hcurrency:1813|h|TInterface\ICONS\Spell_AnimaBastion_Orb.BLP:0|t|h,"The wilderlings are benevolent, magical creatures of Ardenweald, and are drawn to souls that are strong and pure."
1486,Winter Wilderling,|cFFFFD200Covenant: |rNight Fae|n|cFFFFD200Vendor: |rDuchess Mynx|n|cFFFFD200Zone: |rKorthia|n|cFFFFD200Cost: |r1000|Hcurrency:1767|h|TInterface\ICONS\INV_Stygia.BLP:0|t|h|n|cFFFFD200Achievement: |rOn the Offensive,"Wilderlings serve as support units in battle, preserving their allies and rendering enemy magics useless."
1487,Summer Wilderling,|cFFFFD200Covenant: |rNight Fae|n|cFFFFD200Drop:|r Escaped Wilderling|n|cFFFFD200Zone:|r Korthia |n,"Stubborn and rebellious, this wilderling is loyal to very few. But those few are bonded for life."
1489,Obsidian Gravewing,|cFFFFD200Covenant: |rVenthyr|n|cFFFFD200Vendor: |rChachi the Artiste|n|cFFFFD200Zone: |rRevendreth|n|cFFFFD200Cost: |r7500|Hcurrency:1813|h|TInterface\ICONS\Spell_AnimaBastion_Orb.BLP:0|t|h,"In the darkened skies of Revendreth, you cannot see these creatures coming until it is too late."
1490,Sinfall Gravewing,|cFFFFD200Covenant: |rVenthyr|n|cFFFFD200Zone: |rRevendreth,"With anima once again flowing in Sinfall, the Stonewright has been able to infuse these Stoneborn, making them valuable allies in the battles to come."
1491,Pale Gravewing,|cFFFFD200Covenant: |rVenthyr|n|cFFFFD200Vendor: |rDuchess Mynx|n|cFFFFD200Zone: |rKorthia|n|cFFFFD200Cost: |r1000|Hcurrency:1767|h|TInterface\ICONS\INV_Stygia.BLP:0|t|h|n|cFFFFD200Achievement: |rOn the Offensive,Gravewings know no fear and are nearly indestructible -- perfect for an assault on the Maw.
1492,Elysian Aquilon,|cFFFFD200Covenant: |rKyrian|n|cFFFFD200Zone: |rBastion,"With anima once again flowing to the Eternal Forge in Bastion, the plans for the aquilon centurion could be crafted once more."
1493,Forsworn Aquilon,|cFFFFD200Covenant: |rKyrian|n|cFFFFD200Drop:|r Wild Worldcracker|n|cFFFFD200Zone:|r Korthia |n,"Originally produced by the Forsworn with stolen blueprints, these powerful centurion are now earning a reputation across the Shadowlands."
1494,Ascendant's Aquilon,|cFFFFD200Covenant: |rKyrian|n|cFFFFD200Vendor: |rAdjutant Galos|n|cFFFFD200Zone: |rBastion|n|cFFFFD200Cost: |r7500|Hcurrency:1813|h|TInterface\ICONS\Spell_AnimaBastion_Orb.BLP:0|t|h,"The aquilon can rapidly transport aspirants, stewards, and even ascended to a location. Hey, sometimes your wings get tired."
1495,Maldraxxian Corpsefly,|cFFFFD200Covenant: |rNecrolord|n|cFFFFD200Zone: |rMaldraxxus,"Corpseflies were once found throughout Maldraxxus, but many died out in the absence of anima. With anima flowing once again, they swarm."
1496,Regal Corpsefly,|cFFFFD200Covenant: |rNecrolord|n|cFFFFD200Vendor: |rSu Zettai|n|cFFFFD200Zone: |rMaldraxxus|n|cFFFFD200Cost: |r7500|Hcurrency:1813|h|TInterface\ICONS\Spell_AnimaBastion_Orb.BLP:0|t|h,"Only the forces of Maldraxxus would call a corpsefly ""regal."""
1497,Battlefield Swarmer,|cFFFFD200Covenant: |rNecrolord|n|cFFFFD200Vendor: |rDuchess Mynx|n|cFFFFD200Zone: |rKorthia|n|cFFFFD200Cost: |r1000|Hcurrency:1767|h|TInterface\ICONS\INV_Stygia.BLP:0|t|h|n|cFFFFD200Achievement: |rOn the Offensive,Corpseflies are strongly attracted to the smell of dead bodies and will swarm an active battlefield as soon as the first corpse falls.
1500,Sanctum Gloomcharger,|cFFFFD200Drop:|r The Nine|n|cFFFFD200Zone:|r Sanctum of Domination,Only the Jailer's most powerful lieutenants are gifted these steeds to stalk the halls of the Tower.
1501,Soulbound Gloomcharger,|cFFFFD200Drop:|r Mysterious Gift from Ve'nari|n|cFFFFD200Zone:|r The Maw,"Ve'nari has many methods of sneaking around the Maw and disrupting the Jailer's plans, including binding his own minions."
1502,Fallen Charger,|cFFFFD200Drop:|r Fallen Charger|n|cFFFFD200Zone:|r The Maw,"The charger's screams echo across the Maw as it continues a never-ending ride across the land, forever looking for escape from the endless torments it has been forced to endure."
1503,Hand of Nilganihmaht,|cFFFFD200Zone:|r The Maw,"Of all the giants who dared defy the Jailer, Nilganihmaht was the most arrogant. For this transgression, the giant's severed hand was hidden within a veil of torments, and the rings that could summon it back were scattered across the Maw."
1504,Hand of Salaranga,|cFFFFD200Achievement:|r Breaking the Chains|n|cFFFFD200Zone:|r Korthia and The Maw,Salaranga was the most cunning of her kin and hid amongst the Beastwarrens. She struck at the Banished One with a horde of bestial allies. It did not matter.
1505,Amber Shardhide,|cFFFFD200Vendor: |rDuchess Mynx|n|cFFFFD200Zone: |rKorthia|n|cFFFFD200Faction: |rDeath's Advance - Revered|n|cFFFFD200Cost: |r5000|Hcurrency:1767|h|TInterface\ICONS\INV_Stygia.BLP:0|t|h,"The bright colors of Korthian wildlife indicate that they have either few predators, or are tough enough to fight back."
1506,Crimson Shardhide,|cFFFFD200Drop:|r Malbog|n|cFFFFD200Zone:|r Korthia,"When Korthia was pulled into The Maw, only a few hardy species survived."
1507,Darkmaul,|cFFFFD200Zone:|r Korthia,"An older shardhide, Darkmaul was relatively tame and friendly around Korthians. He was thought lost to the calamity."
1508,Fierce Razorwing,|cFFFFD200Drop:|r Death's Advance Supplies|n|cFFFFD200Zone:|r Korthia,"Razorwings generally stay away from other Korthian species, but with time and patience, they can be tamed as well."
1509,Garnet Razorwing,|cFFFFD200Drop:|r Reliwik the Defiant|n|cFFFFD200Zone:|r Korthia,"Korthia was once known for its bright red flowers. Several species were known for consuming or rolling in them, and taking on bright red coloration as a result."
1510,Dusklight Razorwing,|cFFFFD200Zone:|r Korthia,"Razorwings can be seen throughout Korthia, making their nests on high hills and in trees."
1511,"Maelie, the Wanderer",|cFFFFD200Zone:|r Korthia,"A curious and inquisitive doe, she doesn't mean to worry her master, she just gets distracted easily. Especially with all of the new things to see on Korthia."
1513,Sarge's Tale,|cFFFFD200Promotion|r|n,"Hold on a sec, Sarge isn't that large, someone must have spun a tall tale in the Hearthstone Tavern..."
1514,Rampaging Mauler,|cFFFFD200Drop:|r Konthrogz the Obliterator|n|cFFFFD200Zone:|r Korthia,"One would think controlling a rampaging mount would be difficult, but if you can learn to control the direction of the rampage it can be quite useful."
1517,Bound Blizzard,|cFFFFD200Promotion:|r |n,"A flurrious, fridgid friend, frost-flecked for frozen fun."
1520,Soultwisted Deathwalker,|cFFFFD200Achievement: |rShadowlands Keystone Master: Season Two|n|cFFFFD200Category: |rDungeons,"A howling vortex of tormented souls, ridden only by those who wish to demonstrate their impressive tolerance for pain and suffering."
1521,Val'sharah Hippogryph,|cFFFFD200Vendor: |rAridormi|n|cFFFFD200Zone: |rDalaran|n|cFFFFD200Cost: |r5000|Hcurrency:1166|h|TInterface\ICONS\PVECurrency-Justice.blp:0|t|h,"These majestic hippogryphs are as close to a being of the Emerald Dream as any resident of Azeroth can be, and do not bond with a rider easily."
1522,Heartlight Vombata,|cFFFFD200Vendor: |rVilo|n|cFFFFD200Zone: |rZereth Mortis|n|cFFFFD200Faction: |rThe Enlightened - Exalted|n|cFFFFD200Cost: |r5000|Hcurrency:1813|h|TInterface\ICONS\Spell_AnimaBastion_Orb.BLP:0|t|h,"The Enlightened revere all creations of the First Ones, yet for many, the vombata of Zereth Mortis are the most beloved. These creatures are equal parts trusted beast of burden and beloved companion."
1523,Curious Crystalsniffer,|cFFFFD200Profession: |rProtoform Synthesis,"Most vombata enjoy tunneling through the ground, but these sniffers seem to have an unerring ability to locate crystals buried deep underground and will congregate around large deposits."
1524,Darkened Vombata,|cFFFFD200Profession: |rProtoform Synthesis,"The schematic to synthesize these darkened vombata seem to have appeared as a reaction to the Mawsworn invasion. The resulting vombata look different--darker, much like the invaders--but behave normally."
1525,Adorned Vombata,|cFFFFD200Profession: |rProtoform Synthesis,Red-colored vombata are considered lucky by the Enlightened. It was a red vombata that was present when they first arrived in Zereth Mortis.
1526,Deathrunner,|cFFFFD200Profession: |rProtoform Synthesis,These wild cervids are only truly at peace when running through--or between--the lands of Death.
1528,Sundered Zerethsteed,|cFFFFD200Profession: |rProtoform Synthesis,"Whatever the purpose of these cervids once was, it is long forgotten. Though they are not Dominated, they have been corrupted by the unintended presence of Mawsworn in the sacred realm of Zereth Mortis."
1529,Anointed Protostag,|cFFFFD200Vendor: |rVilo|n|cFFFFD200Zone: |rZereth Mortis|n|cFFFFD200Faction: |rThe Enlightened - Revered|n|cFFFFD200Cost: |r5000|Hcurrency:1813|h|TInterface\ICONS\Spell_AnimaBastion_Orb.BLP:0|t|h,Only those most esteemed by the Enlightened are trusted with the reins of this rare cervid.
1531,"Wen Lo, the River's Edge",|cFFFFD200In Game Shop|r|n,"The rivers of Pandaria, like Wen Lo, are unpredictable in nature. They may remain calm, bringing water to the crops, or flood, bringing ruin. Wen Lo reminds us that we must adapt to the challenges of life."
1532,Soaring Spelltome,|cFFFFD200Achievement: |rA Tour of Towers|n|cFFFFD200Category: |rTimewalking,"In the forgotten depths of the Dalaran library, this oversized tome was found flapping madly around the room. Open the pages of this arcane-infused book and hitch a ride to magical adventure."
1533,Forged Spiteflyer,|cFFFFD200Profession: |rProtoform Synthesis,There's nothing that can make you feel as alive quite like riding through the realm of Death while atop a being that hates you.
1534,Buzz,|cFFFFD200Profession: |rProtoform Synthesis,"Buzz buzz buzz, buzz buzz! Buzz buzz buzz buzz buzz. Buzz buzz buzz, buzz buzz buzz."
1535,Bronzewing Vespoid,|cFFFFD200Profession: |rProtoform Synthesis,"Bronzewing vespoids are the result of attempting to synthesize a vespoid queen with no other members of a new hive. While no mortal has yet discovered how to synthesize a hive, the bronzewings are reliable mounts just as they are."
1536,Mawdapted Raptora,|cFFFFD200Profession: |rProtoform Synthesis,"Since the Jailer's incursion, new raptora have been synthesized by Zereth Mortis that are capable of resisting the corrupting influence of the Maw."
1537,Raptora Swooper,|cFFFFD200Profession: |rProtoform Synthesis,"The raptora swooper is one of the most vicious iterations of its kind, perfectly suited for its ecological niche. Needing no further adjustments, the ones synthesized today are identical to those created in the past."
1538,Bronze Helicid,|cFFFFD200Profession: |rProtoform Synthesis,"Some helicids of Zereth Mortis have strangely metallic shells. The ones who do are generally a bronze color, indistinct from the metal any novice miner could work, save that this creature's construction far surpasses the skill of any novice."
