ID,Name_lang,SourceText_lang,Description_lang
424,Vicious Gladiator's Twilight Drake,|cFFFFD200Legacy|r,Heroes who proved their might in the gladiatorial arenas during the Cataclysm were awarded the most exceptional of the twilight drake broods.
425,Flametalon of Alysrazor,|cFFFFD200Drop: |rAlysrazor|n|cFFFFD200Zone: |rFirelands,"As with their matriarch, Alysrazor, the fury and fervor of these elemental avians are unquenchable."
426,Swift Shorestrider,|cFFFFD200Vendor: |rLandro Longshot|n|cFFFFD200Location:|r Booty Bay,"A rarity amongst the tallstrider breeds of Kalimdor, but easily recognized by its pungent dead seaweed aroma."
428,Ruthless Gladiator's Twilight Drake,|cFFFFD200Legacy|r,Heroes who proved their might in the gladiatorial arenas during the Cataclysm were awarded the most exceptional of the twilight drake broods.
429,Swift Forest Strider,|cFFFFD200Vendor: |rLhara|n|cFFFFD200Zone: |rDarkmoon Island|n|cFFFFD200Cost: |r180 |Hcurrency:515|h|Tinterface\icons\inv_misc_ticket_darkmoon_01.blp:0|t|h|n,This vibrant breed can only be found in the forests of Darkmoon Island.
430,Swift Springstrider,"|cFFFFD200Vendor: |rNoblegarden Merchant|n|cFFFFD200Zone: |rDurotar, Eversong Woods, Mulgore, Tirisfal Glades, Azuremyst Isle, |nDun Morogh, Elwynn Forest, Teldrassil|n|cFFFFD200Cost: |r500|Hitem:44791|h|TINTERFACE\ICONS\ACHIEVEMENT_NOBLEGARDEN_CHOCOLATE_EGG.BLP:0|t|h|n","The joys of Noblegarden are best when celebrated with this loyal, loving, and blandly-colored freak of nature."
431,Swift Lovebird,|cFFFFD200World Event:|r Love is in the Air|n|n|cFFFFD200Vendor: |rLovely Merchant (Alliance)|n|cFFFFD200Zone: |rStormwind City|n|cFFFFD200Cost: |r270|Hitem:49927|h|TINTERFACE\ICONS\INV_VALENTINESCARD01.BLP:0|t|h|n|n|cFFFFD200Vendor: |rLovely Merchant (Horde)|n|cFFFFD200Zone: |rOrgrimmar|n|cFFFFD200Cost: |r270|Hitem:49927|h|TINTERFACE\ICONS\INV_VALENTINESCARD01.BLP:0|t|h,It's like red but not quite.
432,White Riding Camel,|cFFFFD200Vendor:|r Landro Longshot|n|cFFFFD200Location:|r Booty Bay|n,"Fennimore Quigley is credited with milking the first camel and breaking the record for ""longest unintentional flight,"" all in the same afternoon."
433,Corrupted Hippogryph,|cFFFFD200Vendor: |rLandro Longshot|n|cFFFFD200Location:|r Booty Bay,It is a sad fact that even the wise and majestic hippogryph may fall prey to corruption.
434,Darkmoon Dancing Bear,|cFFFFD200Vendor: |rLhara|n|cFFFFD200Zone: |rDarkmoon Island|n|cFFFFD200Cost: |r180|Hcurrency:515|h|TINTERFACE\ICONS\INV_Misc_Ticket_Darkmoon_01.blp:0|t|h|n|n,"These fearsome mounts have a habit of suddenly breaking out into dance amid battle, much to the annoyance of their riders."
435,Mountain Horse,|cFFFFD200Vendor: |rAstrid Langstrump|n|cFFFFD200Zone: |rDarnassus|n|cFFFFD200Cost: |r1|TINTERFACE\MONEYFRAME\UI-GOLDICON.BLP:0|t,Images of this breed are often found on kegs of watered-down dwarven brew.
436,Swift Mountain Horse,|cFFFFD200Vendor: |rAstrid Langstrump|n|cFFFFD200Zone: |rDarnassus|n|cFFFFD200Cost: |r10|TINTERFACE\MONEYFRAME\UI-GOLDICON.BLP:0|t,Longs for the day it may return to its home in Gilneas.
439,Tyrael's Charger,|cFFFFD200Trading Post|r,A symbol of justice throughout all known realms.
440,Spectral Gryphon,|cFFFFD200Promotion:|r Scroll of Resurrection|n,"When you said an old friend was coming back, this was not quite what I expected. -Bralla Cloudwing"
441,Spectral Wind Rider,|cFFFFD200Promotion:|r Scroll of Resurrection|n,How do you not fall right through that thing? -Maztha
442,Blazing Drake,|cFFFFD200Drop:|r Elementium Fragment|n|cFFFFD200Location:|r Dragon Soul,"Blazing Drakes exhibit a boundless passion for life, and are considered by many to be among the most loyal mounts on Azeroth."
443,Twilight Harbinger,|cFFFFD200Achievement: |rGlory of the Dragon Soul Raider|n|cFFFFD200Category: |rDungeons & Raids,Whatever dark magic once compelled the Twilight Harbinger is now broken... or is it?
444,Life-Binder's Handmaiden,|cFFFFD200Drop:|r Elementium Fragment|n|cFFFFD200Location:|r Dragon Soul|n|n,"Alexstrasza, the former dragon Aspect of Life, is known to be a kind and patient mentor. Under her tutelage, only the most dedicated pupils acquire the title of ""Life-Binder's Handmaiden."""
445,Experiment 12-B,|cFFFFD200Drop:|r Lesser Cache of the Aspects|n|cFFFFD200Location:|r Dragon Soul|n,"Some believe Experiment 12-B is the result of a covert SI-7 initiative, others consider it the outcome of embyronic tinkering by goblin scientists. No matter the case, this much is certain: given its strength, speed and agility, Experiment 12-B was a success!"
446,Heart of the Aspects,|cFFFFD200In-Game Shop|r,"You are Azeroth's true guardians and the future of this world is in your hands, for the dawning of the age of mortals has begun. - Alexstrasza"
447,Feldrake,|cFFFFD200Vendor: |rLandro Longshot|n|cFFFFD200Location:|r Booty Bay,"Fighting the Burning Legion millennia ago, this valiant drake fell to corruption after its body was infused with raw demonic magic."
448,Jade Cloud Serpent,|cFFFFD200Quest: |rRiding the Skies|n|cFFFFD200Zone: |rThe Jade Forest,Jade Cloud Serpents are light and agile; quick and deadly.
449,Azure Water Strider,|cFFFFD200Vendor: |rNat Pagle|n|cFFFFD200Zone: |rKrasarang Wilds|n|cFFFFD200Faction: |rThe Anglers - Exalted|n|cFFFFD200Cost: |r1000|TINTERFACE\MONEYFRAME\UI-GOLDICON.BLP:0|t,"""Normally bugs are for bait, but how could you look into its eyes and even think that?"" -Nat Pagle"
450,Pandaren Kite,|cFFFFD200Achievement: |rPandaren Ambassador|n|cFFFFD200Category: |rPandaria,"This ""mount,"" awarded by the Lorewalkers of Pandaria, is a reward to the hero of their organization."
451,Jeweled Onyx Panther,|cFFFFD200Profession:|r Jewelcrafting|n,Trade Prince Gallywix recently ordered dozens of these glittering jewel-encrusted mounts to roam the grounds of his pleasure palace.
452,Green Dragon Turtle,|cFFFFD200Vendor: |rTurtlemaster Odai|n|cFFFFD200Zone: |rOrgrimmar|n|cFFFFD200Cost: |r1|TINTERFACE\MONEYFRAME\UI-GOLDICON.BLP:0|t|n|n|cFFFFD200Vendor: |rOld Whitenose|n|cFFFFD200Zone: |rStormwind City|n|cFFFFD200Cost: |r1|TINTERFACE\MONEYFRAME\UI-GOLDICON.BLP:0|t,"Cherished for their heavy carrying capacity and steady gait, these stalwart beasts are the mount of choice for most native Pandaren."
453,Great Red Dragon Turtle,|cFFFFD200Vendor: |rTurtlemaster Odai|n|cFFFFD200Zone: |rOrgrimmar|n|cFFFFD200Cost: |r10|TINTERFACE\MONEYFRAME\UI-GOLDICON.BLP:0|t|n|n|cFFFFD200Vendor: |rOld Whitenose|n|cFFFFD200Zone: |rStormwind City|n|cFFFFD200Cost: |r10|TINTERFACE\MONEYFRAME\UI-GOLDICON.BLP:0|t,"""Packaged upgrades include; dual-lantern fog lights, emergency brew keg, and genuine Tanji leather seat.""  - Turtlemaster Odai"
454,Cindermane Charger,|cFFFFD200Recruit-a-Friend|r,Formed by Ragnaros himself as a gift for the daughter he never had.
455,Obsidian Nightwing,|cFFFFD200Recruit-a-Friend|r ,"When you can't run, you crawl, and when you can't crawl you find someone to carry you."
456,Sapphire Panther,|cFFFFD200Profession: |rJewelcrafting,Legends say that an ancient pandaren emperor crafted the first jeweled panther for his son after the boy's twin brother died of an illness.
457,Jade Panther,|cFFFFD200Profession:|r Jewelcrafting|n,Legends say that an ancient pandaren emperor crafted the first jeweled panther for his son after the boy's twin brother died of an illness.
458,Ruby Panther,|cFFFFD200Profession: |rJewelcrafting,Legends say that an ancient pandaren emperor crafted the first jeweled panther for his son after the boy's twin brother died of an illness.
459,Sunstone Panther,|cFFFFD200Profession: |rJewelcrafting,Legends say that an ancient pandaren emperor crafted the first jeweled panther for his son after the boy's twin brother died of an illness.
460,Grand Expedition Yak,|cFFFFD200Vendor: |rUncle Bigpocket|n|cFFFFD200Zone: |rKun-Lai Summit|n|cFFFFD200Cost: |r120000|TINTERFACE\MONEYFRAME\UI-GOLDICON.BLP:0|t,These beasts of burden are known to carry over five times their own weight and to be capable of lasting several days without food or water.
462,Kafa Yak,|cFFFFD200World Event:|r WoW Remix: Mists of Pandaria,It's unclear whether grummles named this yak after its color or purpose.
463,Amber Scorpion,|cFFFFD200Vendor: |rAmbersmith Zikk|n|cFFFFD200Zone: |rDread Wastes|n|cFFFFD200Faction: |rThe Klaxxi - Exalted|n|cFFFFD200Cost: |r10000|TINTERFACE\MONEYFRAME\UI-GOLDICON.BLP:0|t,The Klaxxi ride massive scorpions into battle against their enemies.  A carapace hardened by amber provides superior protection while on the battlefield.
464,Azure Cloud Serpent,|cFFFFD200Quest: |rRiding the Skies|n|cFFFFD200Zone: |rThe Jade Forest,Azure Cloud Serpents are believed by the Pandaren to be harbingers of good fortune.
465,Golden Cloud Serpent,|cFFFFD200Quest: |rRiding the Skies|n|cFFFFD200Zone: |rThe Jade Forest,Golden Cloud Serpents are a treasure to be enjoyed by all who visit the continent of Pandaria.
466,Thundering Jade Cloud Serpent,|cFFFFD200Vendor: |rShay Pressler (Alliance)|n|cFFFFD200Zone: |rStormwind City|n|cFFFFD200Cost: |r3000|TINTERFACE\MONEYFRAME\UI-GOLDICON.BLP:0|t|n|n|cFFFFD200Vendor: |rGoram (Horde)|n|cFFFFD200Zone: |rOrgrimmar|n|cFFFFD200Cost: |r3000|TINTERFACE\MONEYFRAME\UI-GOLDICON.BLP:0|t,"From their infancy, Thundering Cloud Serpents are drawn to storms. They have been known to chase lightning through the blackened, roiling clouds, and to bathe in the pouring rain."
467,Cataclysmic Gladiator's Twilight Drake,|cFFFFD200Legacy|r,Heroes who proved their might in the gladiatorial arenas during the Cataclysm were awarded the most exceptional of the twilight drake broods.
468,Imperial Quilen,|cFFFFD200Promotion:|r Mists of Pandaria Collector's Edition,"Favorite pets of the ancient Mogu princes, Quilen make loyal and fearless companions and mounts."
469,Depleted-Kyparium Rocket,|cFFFFD200Profession: |rEngineering,When Kyparite is depleted of its amber essence it becomes fairly resistant to the corrosion from rocket fuel.
470,Geosynchronous World Spinner,|cFFFFD200Profession: |rEngineering,This rocket was originally designed to speed up the rotation of the world making for shorter nights.  Gnomes with insomnia can have lofty goals.
471,Onyx Cloud Serpent,|cFFFFD200Quest:|r Surprise Attack!|n|cFFFFD200Location:|r Townlong Steppes|n,"Onyx Cloud serpents are known to be more aggressive and daring than their cousins, the Heavenly Onyx Cloud Serpents."
472,Crimson Cloud Serpent,|cFFFFD200Achievement: |rGlory of the Pandaria Hero|n|cFFFFD200Category: |rDungeons & Raids,"Crimson Cloud Serpents are given to flights of fancy, striking out on a whim for seemingly random journeys, sometimes for days at a time."
473,Heavenly Onyx Cloud Serpent,|cFFFFD200Drop:|r Sha of Anger|n|cFFFFD200Location:|r Kun-Lai Summit,"Heavenly Onyx Cloud Serpents are born with violet scales covering the entirety of their body. Over time, these scales darken to the color of onyx."
474,Heavenly Crimson Cloud Serpent,|cFFFFD200Achievement: |rGlory of the Pandaria Raider|n|cFFFFD200Category: |rDungeons & Raids,Heavenly Crimson Cloud Serpents are considered to be among the noblest of dragons.
475,Heavenly Golden Cloud Serpent,|cFFFFD200Vendor: |rMistweaver Ku|n|cFFFFD200Zone: |rTimeless Isle|n|cFFFFD200Faction: |rEmperor Shaohao - Exalted,"Warmth and hope emanate from this great creature, which glows like a sunrise over the mountains."
476,"Yu'lei, Daughter of Jade",|cFFFFD200Vendor: |rMistweaver Xia|n|cFFFFD200Zone: |rTimeless Isle|n|cFFFFD200Cost: |r5000|Hcurrency:1166|h|TInterface\Icons\pvecurrency-justice.BLP:0|t|h,"Warmth and wisdom emanate from this great creature, which glows like moonlight passing through the finest jade."
477,Heavenly Azure Cloud Serpent,|cFFFFD200Achievement: |rLord of the Reins|n|cFFFFD200Category: |rMounts,"Warmth and serenity emanate from this great creature, which glows like the cloudless sky of a summer afternoon."
478,Astral Cloud Serpent,|cFFFFD200Drop:|r Cache of Pure Energy,It is believed that Astral Cloud Serpents possess answers to some of life's greatest mysteries. Pity they can't talk.
479,Azure Riding Crane,|cFFFFD200Vendor: |rJaluu the Generous|n|cFFFFD200Zone: |rVale of Eternal Blossoms|n|cFFFFD200Faction: |rGolden Lotus - Exalted|n|cFFFFD200Cost: |r500|TINTERFACE\MONEYFRAME\UI-GOLDICON.BLP:0|t,The majestic crane is a treasured friend of the pandaren.
480,Golden Riding Crane,|cFFFFD200Vendor: |rJaluu the Generous|n|cFFFFD200Zone: |rVale of Eternal Blossoms|n|cFFFFD200Faction: |rGolden Lotus - Exalted|n|cFFFFD200Cost: |r2500|TINTERFACE\MONEYFRAME\UI-GOLDICON.BLP:0|t,"The crane is a symbol of wisdom and nobility, their ability to carry us into the skies is nothing short of miraculous. - Jaluu the Generous"
481,Regal Riding Crane,|cFFFFD200Vendor: |rJaluu the Generous|n|cFFFFD200Zone: |rVale of Eternal Blossoms|n|cFFFFD200Faction: |rGolden Lotus - Exalted|n|cFFFFD200Cost: |r1500|TINTERFACE\MONEYFRAME\UI-GOLDICON.BLP:0|t,The crane is a symbol of wisdom and nobility. Their ability to carry us into the skies is nothing short of miraculous. - Jaluu the Generous
482,Jungle Riding Crane,|cFFFFD200World Event:|r WoW Remix: Mists of Pandaria,"A beloved mount in southern Pandaria, the jungle crane is known for its speed and agility honed over a lifetime of avoiding Krasari tigers."
484,Black Riding Yak,|cFFFFD200World Event:|r WoW Remix: Mists of Pandaria,"Grummles traveling Kun-Lai Summit by night prefer to ride this dark-haired yak to remain unseen, though they remove the bells from its caparison first."
485,Modest Expedition Yak,|cFFFFD200World Event:|r WoW Remix: Mists of Pandaria,"Unlike its burden-bearing kin, this yak prefers to travel light and go no more than a mile at a time."
486,Grey Riding Yak,|cFFFFD200Vendor: |rUncle Bigpocket|n|cFFFFD200Zone: |rKun-Lai Summit|n|cFFFFD200Cost: |r3000|TINTERFACE\MONEYFRAME\UI-GOLDICON.BLP:0|t,Riding Yaks are bred to be slimmer and more agile than their kin.
487,Blonde Riding Yak,|cFFFFD200Vendor: |rUncle Bigpocket|n|cFFFFD200Zone: |rKun-Lai Summit|n|cFFFFD200Cost: |r3000|TINTERFACE\MONEYFRAME\UI-GOLDICON.BLP:0|t,Riding Yaks are bred to be slimmer and more agile than their kin.
488,Crimson Water Strider,|cFFFFD200Vendor: |rNat Pagle|n|cFFFFD200Zone: |rGarrison: Fishing Shack|n|cFFFFD200Faction: |rNat Pagle - Honored|n|cFFFFD200Cost: |r100|Hitem:117397|h|TINTERFACE\ICONS\INV_Misc_Coin_19.blp:0|t|h,"""Normally bugs are for bait, but how could you look into its eyes and even think that?"" -Nat Pagle"
492,Black Dragon Turtle,|cFFFFD200Vendor: |rTurtlemaster Odai|n|cFFFFD200Zone: |rOrgrimmar|n|cFFFFD200Cost: |r1|TINTERFACE\MONEYFRAME\UI-GOLDICON.BLP:0|t|n|n|cFFFFD200Vendor: |rOld Whitenose|n|cFFFFD200Zone: |rStormwind City|n|cFFFFD200Cost: |r1|TINTERFACE\MONEYFRAME\UI-GOLDICON.BLP:0|t,"Cherished for their heavy carrying capacity and steady gait, these stalwart beasts are the mount of choice for most native Pandaren."
493,Blue Dragon Turtle,|cFFFFD200Vendor: |rTurtlemaster Odai|n|cFFFFD200Zone: |rOrgrimmar|n|cFFFFD200Cost: |r1|TINTERFACE\MONEYFRAME\UI-GOLDICON.BLP:0|t|n|n|cFFFFD200Vendor: |rOld Whitenose|n|cFFFFD200Zone: |rStormwind City|n|cFFFFD200Cost: |r1|TINTERFACE\MONEYFRAME\UI-GOLDICON.BLP:0|t,"Cherished for their heavy carrying capacity and steady gait, these stalwart beasts are the mount of choice for most native Pandaren."
494,Brown Dragon Turtle,|cFFFFD200Vendor: |rTurtlemaster Odai|n|cFFFFD200Zone: |rOrgrimmar|n|cFFFFD200Cost: |r1|TINTERFACE\MONEYFRAME\UI-GOLDICON.BLP:0|t|n|n|cFFFFD200Vendor: |rOld Whitenose|n|cFFFFD200Zone: |rStormwind City|n|cFFFFD200Cost: |r1|TINTERFACE\MONEYFRAME\UI-GOLDICON.BLP:0|t,"Cherished for their heavy carrying capacity and steady gait, these stalwart beasts are the mount of choice for most native Pandaren."
495,Purple Dragon Turtle,|cFFFFD200Vendor: |rTurtlemaster Odai|n|cFFFFD200Zone: |rOrgrimmar|n|cFFFFD200Cost: |r1|TINTERFACE\MONEYFRAME\UI-GOLDICON.BLP:0|t|n|n|cFFFFD200Vendor: |rOld Whitenose|n|cFFFFD200Zone: |rStormwind City|n|cFFFFD200Cost: |r1|TINTERFACE\MONEYFRAME\UI-GOLDICON.BLP:0|t,"Cherished for their heavy carrying capacity and steady gait, these stalwart beasts are the mount of choice for most native Pandaren."
496,Red Dragon Turtle,|cFFFFD200Vendor: |rTurtlemaster Odai|n|cFFFFD200Zone: |rOrgrimmar|n|cFFFFD200Cost: |r1|TINTERFACE\MONEYFRAME\UI-GOLDICON.BLP:0|t|n|n|cFFFFD200Vendor: |rOld Whitenose|n|cFFFFD200Zone: |rStormwind City|n|cFFFFD200Cost: |r1|TINTERFACE\MONEYFRAME\UI-GOLDICON.BLP:0|t,"Cherished for their heavy carrying capacity and steady gait, these stalwart beasts are the mount of choice for most native Pandaren."
497,Great Green Dragon Turtle,|cFFFFD200Vendor: |rTurtlemaster Odai|n|cFFFFD200Zone: |rOrgrimmar|n|cFFFFD200Cost: |r10|TINTERFACE\MONEYFRAME\UI-GOLDICON.BLP:0|t|n|n|cFFFFD200Vendor: |rOld Whitenose|n|cFFFFD200Zone: |rStormwind City|n|cFFFFD200Cost: |r10|TINTERFACE\MONEYFRAME\UI-GOLDICON.BLP:0|t,"""Packaged upgrades include; dual-lantern fog lights, emergency brew keg, and genuine Tanji leather seat.""  - Turtlemaster Odai"
498,Great Black Dragon Turtle,|cFFFFD200Vendor: |rTurtlemaster Odai|n|cFFFFD200Zone: |rOrgrimmar|n|cFFFFD200Cost: |r10|TINTERFACE\MONEYFRAME\UI-GOLDICON.BLP:0|t|n|n|cFFFFD200Vendor: |rOld Whitenose|n|cFFFFD200Zone: |rStormwind City|n|cFFFFD200Cost: |r10|TINTERFACE\MONEYFRAME\UI-GOLDICON.BLP:0|t,"""Packaged upgrades include; dual-lantern fog lights, emergency brew keg, and genuine Tanji leather seat.""  - Turtlemaster Odai"
499,Great Blue Dragon Turtle,|cFFFFD200Vendor: |rTurtlemaster Odai|n|cFFFFD200Zone: |rOrgrimmar|n|cFFFFD200Cost: |r10|TINTERFACE\MONEYFRAME\UI-GOLDICON.BLP:0|t|n|n|cFFFFD200Vendor: |rOld Whitenose|n|cFFFFD200Zone: |rStormwind City|n|cFFFFD200Cost: |r10|TINTERFACE\MONEYFRAME\UI-GOLDICON.BLP:0|t,"""Packaged upgrades include; dual-lantern fog lights, emergency brew keg, and genuine Tanji leather seat.""  - Turtlemaster Odai"
500,Great Brown Dragon Turtle,|cFFFFD200Vendor: |rTurtlemaster Odai|n|cFFFFD200Zone: |rOrgrimmar|n|cFFFFD200Cost: |r10|TINTERFACE\MONEYFRAME\UI-GOLDICON.BLP:0|t|n|n|cFFFFD200Vendor: |rOld Whitenose|n|cFFFFD200Zone: |rStormwind City|n|cFFFFD200Cost: |r10|TINTERFACE\MONEYFRAME\UI-GOLDICON.BLP:0|t,"""Packaged upgrades include; dual-lantern fog lights, emergency brew keg, and genuine Tanji leather seat.""  - Turtlemaster Odai"
501,Great Purple Dragon Turtle,|cFFFFD200Vendor: |rTurtlemaster Odai|n|cFFFFD200Zone: |rOrgrimmar|n|cFFFFD200Cost: |r10|TINTERFACE\MONEYFRAME\UI-GOLDICON.BLP:0|t|n|n|cFFFFD200Vendor: |rOld Whitenose|n|cFFFFD200Zone: |rStormwind City|n|cFFFFD200Cost: |r10|TINTERFACE\MONEYFRAME\UI-GOLDICON.BLP:0|t,"""Packaged upgrades include; dual-lantern fog lights, emergency brew keg, and genuine Tanji leather seat.""  - Turtlemaster Odai"
503,Crimson Pandaren Phoenix,|cFFFFD200Vendor: |rKai Featherfall|n|cFFFFD200Location: |rVale of Eternal Blossoms|n|cFFFFD200Cost: |r1|Hitem:90045|h|TINTERFACE\ICONS\INV_MISC_PHOENIXEGG.BLP:0|t|h,The plumage of the Crimson Phoenix is said to represent prosperity and happiness.
504,Thundering August Cloud Serpent,|cFFFFD200Vendor: |rSage Whiteheart (Alliance)|n|cFFFFD200Zone: |rVale of Eternal Blossoms|n|cFFFFD200Faction: |rThe August Celestials - Exalted|n|cFFFFD200Cost: |r10000|TINTERFACE\MONEYFRAME\UI-GOLDICON.BLP:0|t|n|n|cFFFFD200Vendor: |rSage Lotusbloom (Horde)|n|cFFFFD200Zone: |rVale of Eternal Blossoms|n|cFFFFD200Faction: |rThe August Celestials - Exalted|n|cFFFFD200Cost: |r10000|TINTERFACE\MONEYFRAME\UI-GOLDICON.BLP:0|t,"From their infancy, Thundering Cloud Serpents are drawn to storms. They have been known to chase lightning through the blackened, roiling clouds, and to bathe in the pouring rain."
505,Green Shado-Pan Riding Tiger,|cFFFFD200Vendor: |rRushi the Fox|n|cFFFFD200Zone: |rTownlong Steppes|n|cFFFFD200Faction: |rShado-Pan - Exalted|n|cFFFFD200Cost: |r1500|TINTERFACE\MONEYFRAME\UI-GOLDICON.BLP:0|t,"""When waking a tiger, use a long stick. Better yet, tell your friend to wake the tiger instead."" -Pandaren Proverb"
506,Blue Shado-Pan Riding Tiger,|cFFFFD200Vendor: |rRushi the Fox|n|cFFFFD200Zone: |rTownlong Steppes|n|cFFFFD200Faction: |rShado-Pan - Exalted|n|cFFFFD200Cost: |r500|TINTERFACE\MONEYFRAME\UI-GOLDICON.BLP:0|t,"""When waking a tiger, use a long stick. Better yet, tell your friend to wake the tiger instead."" -Pandaren Proverb"
507,Red Shado-Pan Riding Tiger,|cFFFFD200Vendor: |rRushi the Fox|n|cFFFFD200Zone: |rTownlong Steppes|n|cFFFFD200Faction: |rShado-Pan - Exalted|n|cFFFFD200Cost: |r2500|TINTERFACE\MONEYFRAME\UI-GOLDICON.BLP:0|t,"""When waking a tiger, use a long stick. Better yet, tell your friend to wake the tiger instead."" -Pandaren Proverb"
508,Brown Riding Goat,|cFFFFD200Vendor: |rGina Mudclaw|n|cFFFFD200Zone: |rValley of the Four Winds|n|cFFFFD200Faction: |rThe Tillers - Exalted|n|cFFFFD200Cost: |r500|TINTERFACE\MONEYFRAME\UI-GOLDICON.BLP:0|t,It takes unflagging patience and a gentle touch to train obstinate mountain goats for riding.
509,Red Flying Cloud,|cFFFFD200Vendor: |rTan Shin Tiao|n|cFFFFD200Zone: |rVale of Eternal Blossoms|n|cFFFFD200Faction: |rThe Lorewalkers - Exalted|n|cFFFFD200Cost: |r600|TINTERFACE\MONEYFRAME\UI-GOLDICON.BLP:0|t,An ancient mogu artifact awarded to those who are deeply committed to the discovery and sharing of Pandaren lore.
510,White Riding Goat,|cFFFFD200Vendor: |rGina Mudclaw|n|cFFFFD200Zone: |rTimeless Isle|n|cFFFFD200Faction: |rThe Tillers - Exalted|n|cFFFFD200Cost: |r3250|TINTERFACE\MONEYFRAME\UI-GOLDICON.BLP:0|t|n|n|cFFFFD200Vendor: |rGina Mudclaw|n|cFFFFD200Zone: |rValley of the Four Winds|n|cFFFFD200Faction: |rThe Tillers - Exalted|n|cFFFFD200Cost: |r3250|TINTERFACE\MONEYFRAME\UI-GOLDICON.BLP:0|t,It takes unflagging patience and a gentle touch to train obstinate mountain goats for riding.
511,Black Riding Goat,|cFFFFD200Vendor: |rGina Mudclaw|n|cFFFFD200Zone: |rTimeless Isle|n|cFFFFD200Faction: |rThe Tillers - Exalted|n|cFFFFD200Cost: |r1500|TINTERFACE\MONEYFRAME\UI-GOLDICON.BLP:0|t|n|n|cFFFFD200Vendor: |rGina Mudclaw|n|cFFFFD200Zone: |rValley of the Four Winds|n|cFFFFD200Faction: |rThe Tillers - Exalted|n|cFFFFD200Cost: |r1500|TINTERFACE\MONEYFRAME\UI-GOLDICON.BLP:0|t,It takes unflagging patience and a gentle touch to train obstinate mountain goats for riding.
515,Son of Galleon,|cFFFFD200Drop:|r Galleon|n|cFFFFD200Location:|r Valley of the Four Winds|n,"Trained from a young age, these massive Mushan are taught to thunder into battle carrying a full saurok warband."
516,Pandaren Kite,|cFFFFD200Achievement: |rPandaren Ambassador|n|cFFFFD200Category: |rPandaria,"This token of honor is a gift from the Lorewalkers of Pandaria. Flying manual seemingly not included, however."
517,Thundering Ruby Cloud Serpent,|cFFFFD200Drop: |rAlani|n|cFFFFD200Zone: |rVale of Eternal Blossoms,"From their infancy, Thundering Cloud Serpents are drawn to storms. They have been known to chase lightning through the blackened, roiling clouds, and to bathe in the pouring rain."
518,Ashen Pandaren Phoenix,|cFFFFD200Vendor: |rWorld Vendors|n|cFFFFD200Cost: |r1|Hitem:90045|h|TINTERFACE\ICONS\INV_MISC_PHOENIXEGG.BLP:0|t|h,Both the name and color of this majestic phoenix are believed to symbolize rebirth.
519,Emerald Pandaren Phoenix,|cFFFFD200Vendor: |rWorld Vendors|n|cFFFFD200Cost: |r1|Hitem:90045|h|TINTERFACE\ICONS\INV_MISC_PHOENIXEGG.BLP:0|t|h,The colors of this rare phoenix's plumage are said to bring great fortune.
520,Violet Pandaren Phoenix,|cFFFFD200Vendor: |rWorld Vendors|n|cFFFFD200Cost: |r1|Hitem:90045|h|TINTERFACE\ICONS\INV_MISC_PHOENIXEGG.BLP:0|t|h,The Violet Phoenix's plumage is said to symbolize a union of opposing forces.
521,Jade Pandaren Kite,|cFFFFD200Achievement: |rWe're Going to Need More Saddles|n|cFFFFD200Category: |rGeneral,"The residents of Pandaria salute your enthusiasm for wildlife preservation. They do have concerns about housing 150 animals per visit, though."
522,Sky Golem,|cFFFFD200Profession: |rEngineering,"A glorious feat of engineering, the sky golem takes traditional shredder technology to a whole new level (and altitude!)."
523,Swift Windsteed,|cFFFFD200In-Game Shop|r,"One of Pandaria's most elusive creatures, said to bring good fortune to its rider."
526,Grand Armored Gryphon,|cFFFFD200Vendor: |rAgent Malley|n|cFFFFD200Zone: |rKrasarang Wilds|n|cFFFFD200Faction: |rOperation: Shieldwall - Exalted|n|cFFFFD200Cost: |r2000|TINTERFACE\MONEYFRAME\UI-GOLDICON.BLP:0|t,This noble gryphon is as staunch a battle companion as any member of the Alliance could ask for.
527,Grand Armored Wyvern,|cFFFFD200Vendor: |rTuskripper Grukna|n|cFFFFD200Zone: |rKrasarang Wilds|n|cFFFFD200Faction: |rDominance Offensive - Exalted|n|cFFFFD200Cost: |r2000|TINTERFACE\MONEYFRAME\UI-GOLDICON.BLP:0|t,"This ferocious beast, renowned among wyvern handlers, was one of the first mounts chosen to take part in the Horde's Dominance Offensive."
528,Grand Gryphon,|cFFFFD200Quest: |rThe Silence|n|cFFFFD200Zone: |rKun-Lai Summit,Gryphons' keen eyesight allows them to see over vast distances and warn their riders of any dangers that lie ahead.
529,Grand Wyvern,|cFFFFD200Quest: |rBreath of Darkest Shadow|n|cFFFFD200Zone: |rKun-Lai Summit,"Wyverns hail from some of the most inhospitable regions of Kalimdor, making them masters of adapting to any environment."
530,Armored Skyscreamer,|cFFFFD200Achievement: |rGlory of the Thundering Raider|n|cFFFFD200Category: |rDungeons & Raids,Only those heroic souls who surmount every challenge the mogu tyrants place before them can proudly fly the skies on a war-prepared skyscreamer.
531,Spawn of Horridon,|cFFFFD200Drop: |rHorridon|n|cFFFFD200Zone: |rThrone of Thunder,"When you see a hurricane coming, you get out of the way. Horridon would fight the hurricane and win."
532,Ghastly Charger,|cFFFFD200Vendor: |rLandro Longshot|n|cFFFFD200Location:|r Booty Bay|n,Not all of Medivh's victims are gone for good.
